<?xml version="1.0" encoding="UTF-8"?>
<jsaparsettings xmlns:xsi="http://www.w3.org/2001/XMLSchema-instance" xsi:noNamespaceSchemaLocation="jsapar.cfg.xsd">
  <errorhandling>
    <parser>
      <exception-threshold>1</exception-threshold>
      <build-error-resultset>false</build-error-resultset>
    </parser>
    <composer>
      <exception-threshold>1</exception-threshold>
      <build-error-resultset>false</build-error-resultset>
    </composer>
  </errorhandling>
  <schemas>
    <schema name="test1" location="/tst-format.xml"/>
    <schema name="test2" location="/tst-format.xml"/>
  </schemas>
</jsaparsettings>
